{"approved_na_record_ref":null,"artifact_metadata":{"classification":"SYNTHETIC_FIXTURE","evidence_claim":"NOT_EVIDENCE_OR_PASS","fixture_notice":"SYNTHETIC EXAMPLE ONLY; NOT EVIDENCE; NOT A PASS VERDICT"},"closing_gate":"M4c","created_at":"2026-06-01T12:30:00Z","effective_result":"PASS","evidence_binding_refs":[{"artifact_id":"fixture-stage-evidence-binding-v2-m4c","artifact_path":"contracts/fixtures/governance-models/valid/evidence-binding-v2-m4c.json","artifact_sha256":"4bd09ab567fa41060b031fc335ff0e58912a7a0e73b81ab589d3136e0f9729ba","revision":1,"schema":"ylx.evidence-binding.v1"}],"evidence_ids":["fixture-stage-evidence-v2-m4c"],"predecessor_result_ref":null,"requirement_id":"PREVIEW-DROP-01","result_id":"fixture-terminal-result-v2-preview-drop-01","revision":1,"schema":"ylx.stage-terminal-result.v2","source_scope_ref":{"artifact_id":"fixture-binding-context-v2-m4","artifact_path":"contracts/fixtures/governance-models/valid/binding-context-v2-m4-r2.json","artifact_sha256":"10e7b41328efd2c8afdde648151b29ca30921bb0694c7bc37df8c269249ecf65","revision":2,"schema":"ylx.binding-context.v2"},"supersession_reason":null}