{"approved_na_record_ref":null,"artifact_metadata":{"classification":"SYNTHETIC_FIXTURE","evidence_claim":"NOT_EVIDENCE_OR_PASS","fixture_notice":"SYNTHETIC EXAMPLE ONLY; NOT EVIDENCE; NOT A PASS VERDICT"},"closing_gate":"M3","created_at":"2026-06-01T12:30:00Z","effective_result":"PASS","evidence_binding_refs":[{"artifact_id":"fixture-stage-evidence-binding-v2-m3","artifact_path":"contracts/fixtures/governance-models/valid/evidence-binding-v2-m3.json","artifact_sha256":"ff4b8f051bde36ba4b263319dbb227207f90853497528237e9702f1c8c051676","revision":1,"schema":"ylx.evidence-binding.v1"}],"evidence_ids":["fixture-stage-evidence-v2-m3"],"predecessor_result_ref":null,"requirement_id":"ENC-DECISION-01","result_id":"fixture-terminal-result-v2-enc-decision-01","revision":1,"schema":"ylx.stage-terminal-result.v2","source_scope_ref":{"artifact_id":"fixture-binding-context-v2-m3","artifact_path":"contracts/fixtures/governance-models/valid/binding-context-v2-m3.json","artifact_sha256":"bae632ad0563403f39886a0b2a8cf5228ef564b0fec96b52040e319a79a6e1e2","revision":1,"schema":"ylx.binding-context.v2"},"supersession_reason":null}