{"approved_na_record_ref":null,"artifact_metadata":{"classification":"SYNTHETIC_FIXTURE","evidence_claim":"NOT_EVIDENCE_OR_PASS","fixture_notice":"SYNTHETIC EXAMPLE ONLY; NOT EVIDENCE; NOT A PASS VERDICT"},"closing_gate":"M1","created_at":"2026-06-01T12:48:00Z","effective_result":"PASS","evidence_binding_refs":[{"artifact_id":"fixture-issue-verdict-evidence-binding-v2-m1","artifact_path":"contracts/fixtures/governance-models/valid/issue-verdict-evidence-binding-v2-m1.json","artifact_sha256":"416750af24256ea7e1527c9df405218cac5d65444feec6ae4ffcc50dee8d91d2","revision":1,"schema":"ylx.evidence-binding.v1"}],"evidence_ids":["fixture-issue-register-gate-verdict-m1"],"predecessor_result_ref":null,"requirement_id":"M1-ISSUES-01","result_id":"fixture-terminal-result-v2-m1-issues-01","revision":1,"schema":"ylx.stage-terminal-result.v2","source_scope_ref":{"artifact_id":"fixture-m1-decision-scope","artifact_path":"contracts/fixtures/governance-models/valid/release-source-scope-m1.json","artifact_sha256":"9ab1d23e80598e5c51be74700dff85407a4fc66cf0b52850417bf7ceac477602","revision":1,"schema":"ylx.stage-source-scope.v1"},"supersession_reason":null}