{"approved_na_record_ref":null,"artifact_metadata":{"classification":"SYNTHETIC_FIXTURE","evidence_claim":"NOT_EVIDENCE_OR_PASS","fixture_notice":"SYNTHETIC EXAMPLE ONLY; NOT EVIDENCE; NOT A PASS VERDICT"},"closing_gate":"M1","created_at":"2026-06-01T12:30:00Z","effective_result":"PASS","evidence_binding_refs":[{"artifact_id":"fixture-stage-evidence-binding-v2-m1","artifact_path":"contracts/fixtures/governance-models/valid/evidence-binding-v2-m1.json","artifact_sha256":"943d7b0e9c78433a42bffdba88a415d08c16595a176878359633d11a1a76eba3","revision":1,"schema":"ylx.evidence-binding.v1"}],"evidence_ids":["fixture-stage-evidence-v2-m1"],"predecessor_result_ref":null,"requirement_id":"M1-REMOTE-01","result_id":"fixture-terminal-result-v2-m1-remote-01","revision":1,"schema":"ylx.stage-terminal-result.v2","source_scope_ref":{"artifact_id":"fixture-m1-decision-scope","artifact_path":"contracts/fixtures/governance-models/valid/release-source-scope-m1.json","artifact_sha256":"9ab1d23e80598e5c51be74700dff85407a4fc66cf0b52850417bf7ceac477602","revision":1,"schema":"ylx.stage-source-scope.v1"},"supersession_reason":null}