{"approved_na_record_ref":null,"artifact_metadata":{"classification":"SYNTHETIC_FIXTURE","evidence_claim":"NOT_EVIDENCE_OR_PASS","fixture_notice":"SYNTHETIC EXAMPLE ONLY; NOT EVIDENCE; NOT A PASS VERDICT"},"closing_gate":"M5","created_at":"2026-06-01T12:30:00Z","effective_result":"PASS","evidence_binding_refs":[{"artifact_id":"fixture-stage-evidence-binding-v2-m5-canary-validation","artifact_path":"contracts/fixtures/governance-models/valid/evidence-binding-v2-m5-canary-validation.json","artifact_sha256":"62043dd518d7df77b312c686319013b53b9606fa131fd6013d3efdc92958e907","revision":1,"schema":"ylx.evidence-binding.v1"}],"evidence_ids":["fixture-stage-evidence-v2-m5-canary-validation"],"predecessor_result_ref":null,"requirement_id":"M0-MEAS-10","result_id":"fixture-terminal-result-v2-m0-meas-10","revision":1,"schema":"ylx.stage-terminal-result.v2","source_scope_ref":{"artifact_id":"fixture-binding-context-v2-m5","artifact_path":"contracts/fixtures/governance-models/valid/binding-context-v2-m5.json","artifact_sha256":"763f34fcb78fae4d4de0473fe500220e7bec310d5f61799f7a44f378c27747e3","revision":1,"schema":"ylx.binding-context.v2"},"supersession_reason":null}