{"approved_na_record_ref":null,"artifact_metadata":{"classification":"SYNTHETIC_FIXTURE","evidence_claim":"NOT_EVIDENCE_OR_PASS","fixture_notice":"SYNTHETIC EXAMPLE ONLY; NOT EVIDENCE; NOT A PASS VERDICT"},"closing_gate":"M4a","created_at":"2026-06-01T12:30:00Z","effective_result":"PASS","evidence_binding_refs":[{"artifact_id":"fixture-stage-evidence-binding-v2-m4a","artifact_path":"contracts/fixtures/governance-models/valid/evidence-binding-v2-m4a.json","artifact_sha256":"9f10fb1965b0011b3861bb96d49869ac904d88906761495f1d01c2722aa48e39","revision":1,"schema":"ylx.evidence-binding.v1"}],"evidence_ids":["fixture-stage-evidence-v2-m4a"],"predecessor_result_ref":null,"requirement_id":"WEB-AUTHORITY-01","result_id":"fixture-terminal-result-v2-web-authority-01","revision":1,"schema":"ylx.stage-terminal-result.v2","source_scope_ref":{"artifact_id":"fixture-binding-context-v2-m4","artifact_path":"contracts/fixtures/governance-models/valid/binding-context-v2-m4-r2.json","artifact_sha256":"10e7b41328efd2c8afdde648151b29ca30921bb0694c7bc37df8c269249ecf65","revision":2,"schema":"ylx.binding-context.v2"},"supersession_reason":null}