{"approved_na_record_ref":null,"artifact_metadata":{"classification":"SYNTHETIC_FIXTURE","evidence_claim":"NOT_EVIDENCE_OR_PASS","fixture_notice":"SYNTHETIC EXAMPLE ONLY; NOT EVIDENCE; NOT A PASS VERDICT"},"closing_gate":"M2","created_at":"2026-06-01T12:30:00Z","effective_result":"PASS","evidence_binding_refs":[{"artifact_id":"fixture-stage-evidence-binding-v2-m2","artifact_path":"contracts/fixtures/governance-models/valid/evidence-binding-v2-m2.json","artifact_sha256":"b7ad2fa3f6bc97f9b34fdf7d013ff270ee5a7de52507b554943aeae8ad2e5756","revision":1,"schema":"ylx.evidence-binding.v1"}],"evidence_ids":["fixture-stage-evidence-v2-m2"],"predecessor_result_ref":null,"requirement_id":"M2-SCHEMA-01","result_id":"fixture-terminal-result-v2-m2-schema-01","revision":1,"schema":"ylx.stage-terminal-result.v2","source_scope_ref":{"artifact_id":"fixture-binding-context-v2-m2-qualification","artifact_path":"contracts/fixtures/governance-models/valid/binding-context-v2-m2.json","artifact_sha256":"ae17194abe180fc54bf8223ded255234fc6b554c43a3e56abb70db2b70317599","revision":1,"schema":"ylx.binding-context.v2"},"supersession_reason":null}