{"approved_na_record_ref":null,"artifact_metadata":{"classification":"SYNTHETIC_FIXTURE","evidence_claim":"NOT_EVIDENCE_OR_PASS","fixture_notice":"SYNTHETIC EXAMPLE ONLY; NOT EVIDENCE; NOT A PASS VERDICT"},"closing_gate":"M0","created_at":"2026-06-01T12:30:00Z","effective_result":"PASS","evidence_binding_refs":[{"artifact_id":"fixture-stage-evidence-binding-v2-m0","artifact_path":"contracts/fixtures/governance-models/valid/evidence-binding-v2-m0.json","artifact_sha256":"0d94e160214f00145aabbf5e229f5691f8fc1e9a00092e6f2be78a649fb1db6d","revision":1,"schema":"ylx.evidence-binding.v1"}],"evidence_ids":["fixture-stage-evidence-v2-m0"],"predecessor_result_ref":null,"requirement_id":"M0-CORPUS-01","result_id":"fixture-terminal-result-v2-m0-corpus-01","revision":1,"schema":"ylx.stage-terminal-result.v2","source_scope_ref":{"artifact_id":"fixture-m0-baseline-scope","artifact_path":"contracts/fixtures/governance-models/valid/release-source-scope-m0.json","artifact_sha256":"e7bcf0d34b0a2837dbac9be7acb7bf30ce3d650f8aa1be3815c93bc19cd381fb","revision":1,"schema":"ylx.stage-source-scope.v1"},"supersession_reason":null}